{
  "extraction_id": "hydrocortisone_causes_side_effect_adrenal_suppression",
  "snippet_id": "hydrocortisone_side_effects_01",
  "label": "causes_side_effect",
  "subject": {
    "type": "drug",
    "value": "Hydrocortisone"
  },
  "object": {
    "type": "effect",
    "value": "adrenal suppression"
  }
}
