{
  "extraction_id": "hydrocortisone_causes_side_effect_candidiasis",
  "snippet_id": "hydrocortisone_lead_adverse_warning_01",
  "label": "causes_side_effect",
  "subject": {
    "type": "drug",
    "value": "Hydrocortisone"
  },
  "object": {
    "type": "effect",
    "value": "candidiasis"
  }
}
