{
  "extraction_id": "morphine_treats_condition_opioid_addiction",
  "snippet_id": "morphine_medical_uses_opioid_use_disorder_01",
  "label": "treats_condition",
  "subject": {
    "type": "drug",
    "value": "Morphine"
  },
  "object": {
    "type": "condition",
    "value": "opioid addiction"
  }
}
