{
  "extraction_id": "insulin_causes_side_effect_type_i_hypersensitivity_reaction",
  "snippet_id": "insulin_medication_side_effects_01",
  "label": "causes_side_effect",
  "subject": {
    "type": "drug",
    "value": "Insulin"
  },
  "object": {
    "type": "effect",
    "value": "type i hypersensitivity reaction"
  }
}
