{
  "extraction_id": "metformin_contraindicated_for_severely_impaired_kidney_function",
  "snippet_id": "metformin_lactic_acidosis_01",
  "label": "contraindicated_for",
  "subject": {
    "type": "drug",
    "value": "Metformin"
  },
  "object": {
    "type": "condition",
    "value": "severely impaired kidney function"
  }
}
