{
  "extraction_id": "warfarin_treats_condition_thromboembolic_complication_treatment_in_atrial_fibrillation",
  "snippet_id": "warfarin_medical_uses_01",
  "label": "treats_condition",
  "subject": {
    "type": "drug",
    "value": "Warfarin"
  },
  "object": {
    "type": "condition",
    "value": "thromboembolic complication treatment in atrial fibrillation"
  }
}
