{
  "extraction_id": "morphine_causes_side_effect_impaired_maddox_wing_test_performance",
  "snippet_id": "morphine_performance_01",
  "label": "causes_side_effect",
  "subject": {
    "type": "drug",
    "value": "Morphine"
  },
  "object": {
    "type": "effect",
    "value": "impaired maddox wing test performance"
  }
}
