{
  "extraction_id": "atorvastatin_treats_condition_heart_attack_prevention",
  "snippet_id": "atorvastatin_cardiovascular_01",
  "label": "treats_condition",
  "subject": {
    "type": "drug",
    "value": "Atorvastatin"
  },
  "object": {
    "type": "condition",
    "value": "heart attack prevention"
  }
}
