{
  "extraction_id": "atorvastatin_causes_side_effect_unusual_bleeding",
  "snippet_id": "atorvastatin_side_effects_other_05",
  "label": "causes_side_effect",
  "subject": {
    "type": "drug",
    "value": "Atorvastatin"
  },
  "object": {
    "type": "effect",
    "value": "unusual bleeding"
  }
}
