{
  "extraction_id": "paracetamol_causes_side_effect_gastrointestinal_bleeding",
  "snippet_id": "paracetamol_lead_adverse_01",
  "label": "causes_side_effect",
  "subject": {
    "type": "drug",
    "value": "Paracetamol"
  },
  "object": {
    "type": "effect",
    "value": "gastrointestinal bleeding"
  }
}
