{
  "extraction_id": "atorvastatin_causes_side_effect_increased_fasting_blood_glucose",
  "snippet_id": "atorvastatin_side_effects_glucose_01",
  "label": "causes_side_effect",
  "subject": {
    "type": "drug",
    "value": "Atorvastatin"
  },
  "object": {
    "type": "effect",
    "value": "increased fasting blood glucose"
  }
}
