{
  "extraction_id": "atorvastatin_causes_side_effect_lower_leg_swelling",
  "snippet_id": "atorvastatin_side_effects_other_15",
  "label": "causes_side_effect",
  "subject": {
    "type": "drug",
    "value": "Atorvastatin"
  },
  "object": {
    "type": "effect",
    "value": "lower leg swelling"
  }
}
