{
  "extraction_id": "insulin_treats_condition_diabetic_ketoacidosis_2",
  "snippet_id": "insulin_medication_medical_uses_01",
  "label": "treats_condition",
  "subject": {
    "type": "drug",
    "value": "Insulin"
  },
  "object": {
    "type": "condition",
    "value": "diabetic ketoacidosis"
  }
}
